{
  "schema_version": 4,
  "model": "nvidia/GLM-5.2-NVFP4@aec724e8c7b8ee9db3b48c01c320f63f9cdaf8aa",
  "model_role": "draft",
  "num_moe_layers": 1,
  "num_logical_experts": 256,
  "expert_parallel_size": 4,
  "experts_per_rank": 64,
  "experts_per_token": 8,
  "count_semantics": "logical_routed_token_assignments",
  "aggregation": {
    "scope": "replay_window_within_role_specific_token_ceiling",
    "observed_eplb_step_min": 0,
    "observed_eplb_step_max": 2999,
    "record_count": 7973,
    "raw_record_count": 7974,
    "discarded_oversized_record_count": 1,
    "discarded_oversized_eplb_steps": [
      2250
    ],
    "max_tokens_per_step": 2048,
    "replay_start_monotonic_ns": 654798806406065,
    "replay_end_monotonic_ns": 655175538654511,
    "observed_monotonic_ns_min": 654800438012609,
    "observed_monotonic_ns_max": 655175093503311,
    "discarded_outside_replay_window_record_count": 0,
    "max_forwards_per_step": 5
  },
  "expert_partitioning": {
    "kind": "contiguous_logical_expert_ids",
    "layout": "rank_major"
  },
  "counts_by_layer": [
    [
      424092,
      715297,
      336212,
      84592,
      49084,
      38688,
      152564,
      129627,
      342552,
      342581,
      212353,
      70544,
      27528,
      461752,
      48392,
      215972,
      170273,
      77100,
      397356,
      256619,
      20820,
      152844,
      229128,
      213458,
      122972,
      108600,
      254220,
      534755,
      132776,
      858363,
      818557,
      26168,
      586358,
      323756,
      217579,
      374340,
      311652,
      186180,
      18552,
      206688,
      248169,
      265584,
      402840,
      85072,
      489048,
      431961,
      409716,
      258357,
      192916,
      685696,
      351882,
      292320,
      242840,
      72688,
      504155,
      32576,
      69057,
      487276,
      1330110,
      231948,
      557688,
      575496,
      318081,
      440247,
      180660,
      611894,
      490311,
      302245,
      73960,
      194331,
      324004,
      220809,
      93732,
      380645,
      853403,
      390404,
      192464,
      157813,
      274052,
      224732,
      219448,
      291168,
      157956,
      413888,
      173127,
      192063,
      69980,
      455092,
      131020,
      436841,
      270840,
      174764,
      161743,
      408252,
      143360,
      269475,
      476336,
      393168,
      275293,
      323508,
      83560,
      24596,
      75960,
      258243,
      226500,
      319501,
      192356,
      254803,
      116432,
      444124,
      1739995,
      519211,
      638116,
      77132,
      357100,
      259448,
      610492,
      597188,
      268800,
      293260,
      87279,
      58044,
      462888,
      304180,
      326157,
      37212,
      107084,
      760904,
      191836,
      267099,
      52396,
      281408,
      195980,
      537632,
      374947,
      529078,
      1806162,
      32924,
      226172,
      251780,
      509743,
      284216,
      101304,
      394815,
      266724,
      209244,
      74216,
      349612,
      329607,
      229873,
      252040,
      385397,
      74440,
      291642,
      784252,
      212087,
      489423,
      31500,
      437348,
      334882,
      410945,
      177360,
      315823,
      389672,
      314777,
      574660,
      265944,
      140095,
      339020,
      538716,
      349518,
      678427,
      69168,
      321913,
      283656,
      151732,
      130032,
      208177,
      308340,
      343548,
      367739,
      642316,
      248736,
      364814,
      379332,
      89865,
      296895,
      388860,
      64889,
      302704,
      304877,
      619356,
      269440,
      845416,
      77904,
      467496,
      282960,
      576168,
      391064,
      576769,
      171328,
      216735,
      458668,
      66472,
      270786,
      26436,
      369471,
      175437,
      384551,
      245627,
      336908,
      560501,
      240352,
      1387857,
      76316,
      932064,
      86941,
      239800,
      87376,
      433888,
      282685,
      311688,
      785824,
      695411,
      261744,
      341087,
      348664,
      200028,
      401692,
      160168,
      596204,
      311604,
      788224,
      577888,
      180636,
      322508,
      306620,
      270304,
      74317,
      413394,
      263800,
      355924,
      399733,
      485217,
      257879,
      165064,
      519292,
      179829,
      95952,
      302293,
      367928,
      284132,
      145559,
      152404,
      567628,
      232935
    ]
  ],
  "probabilities_by_layer": [
    [
      0.0051118401563845185,
      0.00862191205762282,
      0.004052568788513699,
      0.0010196390936609962,
      0.0005916394608622131,
      0.0004663301169798163,
      0.0018389471662248937,
      0.001562473482054969,
      0.004128988684648212,
      0.004129338239378165,
      0.002559620536885208,
      0.0008503099610272995,
      0.00033181181400486926,
      0.005565779160868076,
      0.0005832983617888562,
      0.0026032425564610443,
      0.0020524045701122897,
      0.0009293334372193919,
      0.004789574802590775,
      0.0030931856981297424,
      0.0002509561888833689,
      0.0018423221774106452,
      0.0027618198677458474,
      0.002572939777457548,
      0.001482256698336486,
      0.0013090221956164197,
      0.00306426908443468,
      0.006445728952273099,
      0.0016004303042832942,
      0.010346374022982475,
      0.00986656796848241,
      0.0003154189025312198,
      0.0070677314601956965,
      0.0039024290051932744,
      0.0026226127099449816,
      0.004512148883122013,
      0.003756532093077794,
      0.0022441413662970997,
      0.00022361859827878288,
      0.002491336828430631,
      0.0029913326819883176,
      0.003201246324130674,
      0.00485567680738599,
      0.0010254248271222841,
      0.005894794537033322,
      0.005206690024315509,
      0.004938557439218941,
      0.003114134874704156,
      0.002325334492537175,
      0.008265113107232012,
      0.004241448878801998,
      0.0035235116779244184,
      0.0029270989869566427,
      0.0008761529038210527,
      0.006076888444115986,
      0.0003926584442394152,
      0.0008323862409086841,
      0.005873435537672068,
      0.0160326290295705,
      0.0027958110518309146,
      0.006722154421997513,
      0.006936805133411299,
      0.003834024760624921,
      0.005306566248190994,
      0.002177605431492287,
      0.00737553248033622,
      0.005910018248203337,
      0.0036431437708479265,
      0.000891485097493466,
      0.002342390352636597,
      0.0039054183008149397,
      0.002661545874694899,
      0.0011298091016530227,
      0.004588146902858307,
      0.010286588110549166,
      0.004705778096293119,
      0.0023198862601944625,
      0.001902216572346354,
      0.0033033163052768977,
      0.002708832192129551,
      0.002645140909609872,
      0.003509625917617327,
      0.0019039402387733629,
      0.004988845105886637,
      0.002086805576984198,
      0.0023150527620320114,
      0.000843511724210286,
      0.005485502109092704,
      0.0015792641627040821,
      0.0052655116478386044,
      0.0032646001055317785,
      0.0021065373388094656,
      0.0019495872650606499,
      0.004920910952162013,
      0.0017280057271046956,
      0.0032481469260012405,
      0.005741569029200211,
      0.004739094278141036,
      0.0033182748369966026,
      0.0038994397095716087,
      0.0010071997667192268,
      0.0002964706254455015,
      0.0009155923202488328,
      0.0031127607630071,
      0.0027301429770452954,
      0.003851140888781231,
      0.0023185844701656727,
      0.0030712963398678694,
      0.0014034260799264363,
      0.005353298099502273,
      0.020973223529112267,
      0.006258367617018388,
      0.007691602277881835,
      0.0009297191527834778,
      0.00430434462297075,
      0.0031272853647172087,
      0.007358633317184708,
      0.007198272071416008,
      0.003240010738321304,
      0.0035348420726194407,
      0.0010520271474328314,
      0.0006996398188062566,
      0.005579472063393124,
      0.0036664675088637438,
      0.003931369726111092,
      0.00044853898658635553,
      0.0012907489207678517,
      0.009171641111724827,
      0.002312316592249277,
      0.0032195075453678645,
      0.0006315610217451006,
      0.003391982670571137,
      0.0023622667577983974,
      0.006480407192206694,
      0.004519465425228266,
      0.00637730060048199,
      0.021770774833139446,
      0.000396853100998849,
      0.0027261893925134154,
      0.0030348582726731324,
      0.006144244024494481,
      0.003425829211319672,
      0.0012210790470048416,
      0.00475894657608008,
      0.0032149874411012335,
      0.0025221458591119903,
      0.000894570822006153,
      0.004214087180974657,
      0.0039729546853641004,
      0.0027707998082222214,
      0.00303799221163133,
      0.004645425664125059,
      0.000897270830954754,
      0.003515339329410349,
      0.00945306883017098,
      0.002556414276258744,
      0.005899314641299954,
      0.00037968875839702784,
      0.00527162282880709,
      0.00403653748538138,
      0.0049533713276021145,
      0.002137828513945932,
      0.003806807706134112,
      0.004696954852764655,
      0.0037941996286330547,
      0.006926728314299556,
      0.0032055856242266404,
      0.0016886506859565592,
      0.004086415329262234,
      0.006493473306940103,
      0.0042129541415051545,
      0.008177495406127631,
      0.000833724191771607,
      0.0038802141994242036,
      0.003419079188948169,
      0.0018289185615586612,
      0.0015673551946629308,
      0.002509284655772002,
      0.0037166105321949066,
      0.004140994081580385,
      0.004432582994417925,
      0.007742227445668106,
      0.002998167079639464,
      0.0043973261811382,
      0.0045723205111194085,
      0.0010831977864555209,
      0.00357865694997732,